{
  "schemaVersion": "0.1.0",
  "kind": "qop-canonical-record",
  "problem": {
    "kind": "Problem",
    "id": "v2-op-43d4aca67bd52554",
    "accession": null,
    "aliases": ["op_43d4aca67bd52554", "open-problem-v2-problem-1"],
    "catalogState": "candidate",
    "title": "Quantum capacity of a qubit Pauli channel",
    "proposed": null,
    "topicId": "quantum-channels",
    "collectionId": "open-problem-v2",
    "question": {
      "type": "Exact capacity",
      "summary": "Known achievable rates and converse bounds do not determine the quantum capacity of a general qubit Pauli channel.",
      "importance": "An exact formula would characterize the quantum communication rate of the basic four-error qubit noise model and resolve gaps left by degenerate coding gains.",
      "unresolved": "Determine the quantum capacity of the general qubit Pauli channel."
    },
    "keywords": [
      "Pauli channels",
      "Quantum capacity",
      "Quantum Shannon theory",
      "Coherent information",
      "Qubit systems"
    ],
    "relatedProblemIds": []
  },
  "statements": [
    {
      "kind": "StatementVersion",
      "id": "v2-op-43d4aca67bd52554-statement-v1",
      "problemId": "v2-op-43d4aca67bd52554",
      "version": 1,
      "supersedesStatementId": null,
      "created": "2026-09-01",
      "bodyPath": "statements/v1.md",
      "sourceRefs": [
        {
          "sourceId": "source-open-problem-v2-problem-1",
          "relationship": "source-record",
          "locator": "problem_pool/problem_1.tex",
          "primary": true
        }
      ],
      "targetClauses": [
        {
          "id": "general-pauli-capacity",
          "label": "General qubit Pauli-channel capacity",
          "text": "Determine the quantum capacity for every valid qubit Pauli error distribution.",
          "resolutionCriteria": "Give a proved exact capacity formula or an equivalent complete characterization for every valid probability vector."
        }
      ]
    }
  ],
  "claims": [],
  "evidence": [],
  "decisions": [
    {
      "kind": "Decision",
      "id": "decision-v2-pauli-capacity-import-2026-09-01",
      "problemId": "v2-op-43d4aca67bd52554",
      "statementId": "v2-op-43d4aca67bd52554-statement-v1",
      "decisionType": "status-assessment",
      "outcome": "accepted",
      "supersedesDecisionId": null,
      "status": "open",
      "effectiveDate": "2026-09-01",
      "verified": "2026-09-01",
      "evidenceIds": [],
      "rationale": "The source record is marked Unsolved; this import validates representation and does not yet publish the record through API v1."
    }
  ],
  "editorial": {
    "cautions": [],
    "interpretation": "Import-only vertical slice; the source record has not yet entered the reviewed public catalog.",
    "provenance": {
      "kind": "source-stated",
      "label": "Imported source record",
      "note": "The canonical example preserves the v2 source ID, tags, status, statement text, and source digest."
    }
  },
  "compatibility": {
    "apiV1": null,
    "archivePagePath": null,
    "sourceImport": {
      "format": "open-problem-v2-json-1.1",
      "sourceJsonPath": "open_problem_v2/problem_pool_json/problem_1.json",
      "sourceId": "op_43d4aca67bd52554",
      "sourceSha256": "ca72d1de7a12d4a4f8591c1c83ea725601dd028b0ce13cdb60f93a72c03adbce"
    }
  }
}
